{
  "system": "eve-vercel",
  "systemVersion": "v18",
  "briefId": "boston-boho",
  "runId": "wrun_41M19J5EXM0GNYZSRS8JJSWQ7H",
  "traceUrl": "https://smith.langchain.com/o/0462efe1-3c34-4dee-bc82-2cbf213fe2ab/projects/p/c567bb52-f6eb-42f1-9b21-f074f9cc3d03/r/00000000-0000-0000-2d44-258031b5a297?poll=true",
  "startedAt": "2026-08-30T14:46:17.176Z",
  "wallClockMs": 113955,
  "status": "waiting",
  "agents": [
    {
      "id": "wrun_41M19J5EXM0GNYZSRS8JJSWQ7H",
      "label": "Venus",
      "role": "root",
      "model": "dynamic:token-factory/Qwen/Qwen3-235B-A22B-Instruct-2507",
      "status": "waiting",
      "steps": 5,
      "toolCalls": 8,
      "failedActions": 0,
      "refusedActions": 0,
      "searches": 1,
      "vendorsRecorded": 0,
      "truncations": 0,
      "inputTokens": 83165,
      "outputTokens": 1237,
      "costUsd": 0.0173752,
      "durationMs": 102781,
      "corpusHits": 0
    },
    {
      "id": "wrun_41M19J5YGN0GPG49VYQAYHEHP8",
      "label": "catering",
      "role": "specialist",
      "model": "token-factory/Qwen/Qwen3-235B-A22B-Instruct-2507",
      "status": "completed",
      "steps": 23,
      "toolCalls": 22,
      "failedActions": 1,
      "refusedActions": 1,
      "searches": 6,
      "vendorsRecorded": 3,
      "truncations": 0,
      "inputTokens": 746315,
      "outputTokens": 1726,
      "costUsd": 0.1502986,
      "durationMs": 75491,
      "corpusHits": 0
    },
    {
      "id": "wrun_41M19J5YAR0GK3VKDGPDN9FNWF",
      "label": "photography",
      "role": "specialist",
      "model": "token-factory/Qwen/Qwen3-235B-A22B-Instruct-2507",
      "status": "completed",
      "steps": 15,
      "toolCalls": 14,
      "failedActions": 1,
      "refusedActions": 0,
      "searches": 4,
      "vendorsRecorded": 4,
      "truncations": 0,
      "inputTokens": 332624,
      "outputTokens": 2199,
      "costUsd": 0.0678442,
      "durationMs": 63036,
      "corpusHits": 0
    },
    {
      "id": "wrun_41M19J5YXD0GXNSC14WYCYEWXY",
      "label": "music",
      "role": "specialist",
      "model": "token-factory/Qwen/Qwen3-235B-A22B-Instruct-2507",
      "status": "completed",
      "steps": 14,
      "toolCalls": 13,
      "failedActions": 0,
      "refusedActions": 0,
      "searches": 4,
      "vendorsRecorded": 3,
      "truncations": 0,
      "inputTokens": 521208,
      "outputTokens": 1354,
      "costUsd": 0.105054,
      "durationMs": 72560,
      "corpusHits": 0
    },
    {
      "id": "wrun_41M19J5Y4Y0GJ59TYMWVBP4FF0",
      "label": "venue",
      "role": "specialist",
      "model": "token-factory/Qwen/Qwen3-235B-A22B-Instruct-2507",
      "status": "completed",
      "steps": 15,
      "toolCalls": 14,
      "failedActions": 1,
      "refusedActions": 0,
      "searches": 2,
      "vendorsRecorded": 3,
      "truncations": 0,
      "inputTokens": 757052,
      "outputTokens": 2456,
      "costUsd": 0.152884,
      "durationMs": 70058,
      "corpusHits": 0
    },
    {
      "id": "wrun_41M19J5YQ60GV73FDYMZ797WRY",
      "label": "florals",
      "role": "specialist",
      "model": "token-factory/Qwen/Qwen3-235B-A22B-Instruct-2507",
      "status": "completed",
      "steps": 12,
      "toolCalls": 11,
      "failedActions": 0,
      "refusedActions": 0,
      "searches": 4,
      "vendorsRecorded": 2,
      "truncations": 0,
      "inputTokens": 226342,
      "outputTokens": 960,
      "costUsd": 0.0458444,
      "durationMs": 54690,
      "corpusHits": 0
    }
  ],
  "findings": {
    "catering": [
      {
        "name": "Vinwood Caterers",
        "category": "catering",
        "website": "https://www.vinwood.com",
        "inquiryEmail": "contact form only",
        "priceSignal": "starting at $79+ tax per person, no service charges or food minimum",
        "includes": "Farm-to-table menus with ingredients from Bradstreet Farm and other local sources; full bar service including craft cocktails",
        "styleFit": "Specializes in farm-to-table dining with seasonal, locally sourced ingredients perfect for a rustic, outdoorsy wedding",
        "caveat": "Exclusive caterer at the Barn at Bradstreet Farm; must book venue to use",
        "sourceUrl": "https://www.vinwood.com",
        "location": "Ipswich, MA",
        "distanceNote": null,
        "imageUrls": [],
        "fromCorpus": false
      },
      {
        "name": "Fireside Catering",
        "category": "catering",
        "website": "https://www.firesidecatering.com",
        "inquiryEmail": "info@firesidecatering.com",
        "priceSignal": "not listed",
        "includes": "Custom farm-to-table menus with seasonal ingredients from Gibbet Hill Farm; full-service catering including bar with craft cocktails",
        "styleFit": "Offers seasonal, elevated comfort food and family-style options fitting a boho, outdoorsy wedding vibe",
        "caveat": "No published wedding pricing; must inquire for quote based on 110 guests",
        "sourceUrl": "https://www.firesidecatering.com",
        "location": "Burlington, MA",
        "distanceNote": null,
        "imageUrls": [],
        "fromCorpus": false
      },
      {
        "name": "RGKkitchen",
        "category": "catering",
        "website": "https://www.rgkkitchen.com",
        "inquiryEmail": "contact form only",
        "priceSignal": "not listed",
        "includes": "Private chef and catering services with custom menus; potential for family-style farm-to-table meals",
        "styleFit": "Offers custom, elevated comfort food suitable for a boho, outdoorsy wedding with seasonal ingredients",
        "caveat": "Limited online presence with no published wedding menus; primarily serves Cape Cod and surrounding areas",
        "sourceUrl": "https://www.rgkkitchen.com",
        "location": "Dartmouth, MA",
        "distanceNote": null,
        "imageUrls": [],
        "fromCorpus": false
      }
    ],
    "florals": [
      {
        "name": "Passalongs Farm & Florist",
        "category": "florals",
        "website": "https://www.passalongs.com",
        "inquiryEmail": "passalongsfarm@gmail.com",
        "priceSignal": "Bridal bouquet from $275, centerpieces from $90, full setup & delivery min $250 — 2027 prices",
        "includes": "Farm-grown seasonal flowers, centerpieces, personal flowers, ceremony arches, and installations",
        "styleFit": "Cottage garden, rustic, and wildflower-inspired designs using local, seasonal blooms",
        "caveat": "~2.5 hours from Methuen; may not return for strike if drive exceeds 1.5 hours",
        "sourceUrl": "https://www.passalongs.com/full-service-wedding-flower-price-guide/",
        "location": "Florence, MA",
        "distanceNote": null,
        "imageUrls": [],
        "fromCorpus": false
      },
      {
        "name": "Laura Jean Floral Design",
        "category": "florals",
        "website": "https://www.ljfloral.com",
        "inquiryEmail": "studio@ljfloral.com",
        "priceSignal": "not listed",
        "includes": "Full-service wedding florals including bouquets, centerpieces, ceremony installations, and large-scale sculptural pieces",
        "styleFit": "Modern-organic, editorial-style arrangements with movement and texture that align with boho and natural aesthetics",
        "caveat": "No published pricing; minimum likely above $5,000",
        "sourceUrl": "https://www.ljfloral.com/weddings",
        "location": "Cambridge, MA",
        "distanceNote": null,
        "imageUrls": [],
        "fromCorpus": false
      }
    ],
    "music": [
      {
        "name": "The Lion Sisters",
        "category": "music",
        "website": "https://thelionsistersmusic.com",
        "inquiryEmail": "lily@thelionsistersmusic.com",
        "priceSignal": "not listed",
        "includes": "Sibling duo (fiddle, guitar, vocals) with tight harmonies. Blend of folk, bluegrass, Irish fiddle, vintage country, pop/rock. Offer original songs and covers. Can perform at ceremonies, cocktail hours, receptions.",
        "styleFit": "Perfect fit for boho, outdoorsy vibe — acoustic, folk-rooted, with indie and soulful elements. Rural NH roots align with natural wedding setting.",
        "caveat": "Duo (2 members), slightly below requested 3-5. No published pricing.",
        "sourceUrl": "https://thelionsistersmusic.com",
        "location": "New Hampshire, NH",
        "distanceNote": "~30 min from Methuen",
        "imageUrls": [],
        "fromCorpus": false
      },
      {
        "name": "East Coast Soul - Stax Ensemble",
        "category": "music",
        "website": "https://eastcoastsoul.net",
        "inquiryEmail": "info@eastcoastsoul.net",
        "priceSignal": "from $15,000",
        "includes": "7-10 piece ensemble with multiple lead vocalists, horn section, choreography. Performs soul, funk, pop, R&B; can also provide ceremony and cocktail hour music.",
        "styleFit": "Lively, soulful, and energetic band with strong indie and vintage rock influences. Ideal for an upbeat, spirited reception while offering acoustic sets for ceremony/cocktail hours.",
        "caveat": "Starting at $15,000 — above couple's $3,500 budget.",
        "sourceUrl": "https://eastcoastsoul.net/ensembles/stax/",
        "location": "Boston, MA",
        "distanceNote": "~35 min from Methuen",
        "imageUrls": [],
        "fromCorpus": false
      },
      {
        "name": "Lindsay Straw",
        "category": "music",
        "website": "https://lindsaystraw.com",
        "inquiryEmail": "contact@lindsaystraw.com",
        "priceSignal": "not listed",
        "includes": "Solo acoustic performance (guitar, bouzouki, vocals); can coordinate duo or trio with additional musicians. Available for ceremony, cocktail hour, dinner. Provides own sound gear.",
        "styleFit": "Perfect boho, outdoorsy acoustic folk fit — singer-songwriter with Celtic roots, ideal for indie folk and soul vibe.",
        "caveat": "Typically performs solo; duo/trio requires coordination. No published pricing.",